{
  "schema_version": "1.0.0",
  "status": "design_seed_not_published",
  "taxonomy_version": "02B-1D-v1",
  "domains": [
    {
      "id": "D01",
      "name_zh_tw": "AI 基礎與素養",
      "sort_order": 1
    },
    {
      "id": "D02",
      "name_zh_tw": "數學與程式基礎",
      "sort_order": 2
    },
    {
      "id": "D03",
      "name_zh_tw": "資料工程與治理",
      "sort_order": 3
    },
    {
      "id": "D04",
      "name_zh_tw": "機器學習",
      "sort_order": 4
    },
    {
      "id": "D05",
      "name_zh_tw": "深度學習",
      "sort_order": 5
    },
    {
      "id": "D06",
      "name_zh_tw": "自然語言處理",
      "sort_order": 6
    },
    {
      "id": "D07",
      "name_zh_tw": "生成式 AI 與 LLM",
      "sort_order": 7
    },
    {
      "id": "D08",
      "name_zh_tw": "檢索與知識圖譜",
      "sort_order": 8
    },
    {
      "id": "D09",
      "name_zh_tw": "AI Agent 與自動化",
      "sort_order": 9
    },
    {
      "id": "D10",
      "name_zh_tw": "電腦視覺",
      "sort_order": 10
    },
    {
      "id": "D11",
      "name_zh_tw": "語音與多模態",
      "sort_order": 11
    },
    {
      "id": "D12",
      "name_zh_tw": "強化學習與決策",
      "sort_order": 12
    },
    {
      "id": "D13",
      "name_zh_tw": "AI 系統與基礎設施",
      "sort_order": 13
    },
    {
      "id": "D14",
      "name_zh_tw": "AI 安全與倫理",
      "sort_order": 14
    },
    {
      "id": "D15",
      "name_zh_tw": "中國大陸 AI 生態",
      "sort_order": 15
    },
    {
      "id": "D16",
      "name_zh_tw": "產業應用與前沿",
      "sort_order": 16
    }
  ],
  "topics": [
    {
      "id": "D01-T01",
      "domain_id": "D01",
      "name_zh_tw": "AI 概論",
      "sort_order": 1
    },
    {
      "id": "D01-T02",
      "domain_id": "D01",
      "name_zh_tw": "AI 歷史",
      "sort_order": 2
    },
    {
      "id": "D01-T03",
      "domain_id": "D01",
      "name_zh_tw": "AI 工作流程",
      "sort_order": 3
    },
    {
      "id": "D01-T04",
      "domain_id": "D01",
      "name_zh_tw": "AI 責任使用",
      "sort_order": 4
    },
    {
      "id": "D02-T01",
      "domain_id": "D02",
      "name_zh_tw": "數學基礎",
      "sort_order": 1
    },
    {
      "id": "D02-T02",
      "domain_id": "D02",
      "name_zh_tw": "Python 基礎",
      "sort_order": 2
    },
    {
      "id": "D02-T03",
      "domain_id": "D02",
      "name_zh_tw": "資料運算",
      "sort_order": 3
    },
    {
      "id": "D02-T04",
      "domain_id": "D02",
      "name_zh_tw": "軟體工程基礎",
      "sort_order": 4
    },
    {
      "id": "D03-T01",
      "domain_id": "D03",
      "name_zh_tw": "資料蒐集",
      "sort_order": 1
    },
    {
      "id": "D03-T02",
      "domain_id": "D03",
      "name_zh_tw": "資料品質",
      "sort_order": 2
    },
    {
      "id": "D03-T03",
      "domain_id": "D03",
      "name_zh_tw": "資料平台",
      "sort_order": 3
    },
    {
      "id": "D03-T04",
      "domain_id": "D03",
      "name_zh_tw": "資料治理",
      "sort_order": 4
    },
    {
      "id": "D04-T01",
      "domain_id": "D04",
      "name_zh_tw": "監督式學習",
      "sort_order": 1
    },
    {
      "id": "D04-T02",
      "domain_id": "D04",
      "name_zh_tw": "非監督式學習",
      "sort_order": 2
    },
    {
      "id": "D04-T03",
      "domain_id": "D04",
      "name_zh_tw": "模型訓練",
      "sort_order": 3
    },
    {
      "id": "D04-T04",
      "domain_id": "D04",
      "name_zh_tw": "機器學習部署",
      "sort_order": 4
    },
    {
      "id": "D05-T01",
      "domain_id": "D05",
      "name_zh_tw": "神經網路入門",
      "sort_order": 1
    },
    {
      "id": "D05-T02",
      "domain_id": "D05",
      "name_zh_tw": "深度網路架構",
      "sort_order": 2
    },
    {
      "id": "D05-T03",
      "domain_id": "D05",
      "name_zh_tw": "訓練技巧",
      "sort_order": 3
    },
    {
      "id": "D05-T04",
      "domain_id": "D05",
      "name_zh_tw": "深度學習框架",
      "sort_order": 4
    },
    {
      "id": "D06-T01",
      "domain_id": "D06",
      "name_zh_tw": "文字前處理",
      "sort_order": 1
    },
    {
      "id": "D06-T02",
      "domain_id": "D06",
      "name_zh_tw": "語言模型",
      "sort_order": 2
    },
    {
      "id": "D06-T03",
      "domain_id": "D06",
      "name_zh_tw": "NLP 任務",
      "sort_order": 3
    },
    {
      "id": "D06-T04",
      "domain_id": "D06",
      "name_zh_tw": "多語 NLP",
      "sort_order": 4
    },
    {
      "id": "D07-T01",
      "domain_id": "D07",
      "name_zh_tw": "生成模型概論",
      "sort_order": 1
    },
    {
      "id": "D07-T02",
      "domain_id": "D07",
      "name_zh_tw": "LLM 核心",
      "sort_order": 2
    },
    {
      "id": "D07-T03",
      "domain_id": "D07",
      "name_zh_tw": "Prompt 設計",
      "sort_order": 3
    },
    {
      "id": "D07-T04",
      "domain_id": "D07",
      "name_zh_tw": "模型對齊",
      "sort_order": 4
    },
    {
      "id": "D08-T01",
      "domain_id": "D08",
      "name_zh_tw": "資訊檢索",
      "sort_order": 1
    },
    {
      "id": "D08-T02",
      "domain_id": "D08",
      "name_zh_tw": "RAG 系統",
      "sort_order": 2
    },
    {
      "id": "D08-T03",
      "domain_id": "D08",
      "name_zh_tw": "知識圖譜",
      "sort_order": 3
    },
    {
      "id": "D08-T04",
      "domain_id": "D08",
      "name_zh_tw": "Graph RAG",
      "sort_order": 4
    },
    {
      "id": "D09-T01",
      "domain_id": "D09",
      "name_zh_tw": "Agent 架構",
      "sort_order": 1
    },
    {
      "id": "D09-T02",
      "domain_id": "D09",
      "name_zh_tw": "任務規劃",
      "sort_order": 2
    },
    {
      "id": "D09-T03",
      "domain_id": "D09",
      "name_zh_tw": "Agent 安全",
      "sort_order": 3
    },
    {
      "id": "D09-T04",
      "domain_id": "D09",
      "name_zh_tw": "Agent 評測",
      "sort_order": 4
    },
    {
      "id": "D10-T01",
      "domain_id": "D10",
      "name_zh_tw": "影像基礎",
      "sort_order": 1
    },
    {
      "id": "D10-T02",
      "domain_id": "D10",
      "name_zh_tw": "視覺辨識",
      "sort_order": 2
    },
    {
      "id": "D10-T03",
      "domain_id": "D10",
      "name_zh_tw": "視覺表示",
      "sort_order": 3
    },
    {
      "id": "D10-T04",
      "domain_id": "D10",
      "name_zh_tw": "視覺應用",
      "sort_order": 4
    },
    {
      "id": "D11-T01",
      "domain_id": "D11",
      "name_zh_tw": "語音處理",
      "sort_order": 1
    },
    {
      "id": "D11-T02",
      "domain_id": "D11",
      "name_zh_tw": "多模態理解",
      "sort_order": 2
    },
    {
      "id": "D11-T03",
      "domain_id": "D11",
      "name_zh_tw": "即時互動",
      "sort_order": 3
    },
    {
      "id": "D11-T04",
      "domain_id": "D11",
      "name_zh_tw": "多語溝通",
      "sort_order": 4
    },
    {
      "id": "D12-T01",
      "domain_id": "D12",
      "name_zh_tw": "強化學習基礎",
      "sort_order": 1
    },
    {
      "id": "D12-T02",
      "domain_id": "D12",
      "name_zh_tw": "學習演算法",
      "sort_order": 2
    },
    {
      "id": "D12-T03",
      "domain_id": "D12",
      "name_zh_tw": "決策最佳化",
      "sort_order": 3
    },
    {
      "id": "D12-T04",
      "domain_id": "D12",
      "name_zh_tw": "環境與評測",
      "sort_order": 4
    },
    {
      "id": "D13-T01",
      "domain_id": "D13",
      "name_zh_tw": "模型服務",
      "sort_order": 1
    },
    {
      "id": "D13-T02",
      "domain_id": "D13",
      "name_zh_tw": "運算加速",
      "sort_order": 2
    },
    {
      "id": "D13-T03",
      "domain_id": "D13",
      "name_zh_tw": "MLOps",
      "sort_order": 3
    },
    {
      "id": "D13-T04",
      "domain_id": "D13",
      "name_zh_tw": "可觀測性",
      "sort_order": 4
    },
    {
      "id": "D14-T01",
      "domain_id": "D14",
      "name_zh_tw": "AI 安全",
      "sort_order": 1
    },
    {
      "id": "D14-T02",
      "domain_id": "D14",
      "name_zh_tw": "公平與透明",
      "sort_order": 2
    },
    {
      "id": "D14-T03",
      "domain_id": "D14",
      "name_zh_tw": "法律治理",
      "sort_order": 3
    },
    {
      "id": "D14-T04",
      "domain_id": "D14",
      "name_zh_tw": "可信任 AI",
      "sort_order": 4
    },
    {
      "id": "D15-T01",
      "domain_id": "D15",
      "name_zh_tw": "中國大陸模型",
      "sort_order": 1
    },
    {
      "id": "D15-T02",
      "domain_id": "D15",
      "name_zh_tw": "中國大陸平台",
      "sort_order": 2
    },
    {
      "id": "D15-T03",
      "domain_id": "D15",
      "name_zh_tw": "開源生態",
      "sort_order": 3
    },
    {
      "id": "D15-T04",
      "domain_id": "D15",
      "name_zh_tw": "技術評測",
      "sort_order": 4
    },
    {
      "id": "D16-T01",
      "domain_id": "D16",
      "name_zh_tw": "產業 AI",
      "sort_order": 1
    },
    {
      "id": "D16-T02",
      "domain_id": "D16",
      "name_zh_tw": "具身與機器人",
      "sort_order": 2
    },
    {
      "id": "D16-T03",
      "domain_id": "D16",
      "name_zh_tw": "AI 科學",
      "sort_order": 3
    },
    {
      "id": "D16-T04",
      "domain_id": "D16",
      "name_zh_tw": "新興研究",
      "sort_order": 4
    }
  ],
  "nodes": [
    {
      "id": "D01-T01-N01",
      "topic_id": "D01-T01",
      "title_zh_tw": "人工智慧概念",
      "level": "intro",
      "prerequisite_ids": [],
      "suggested_resource_ids": [
        "mit-ocw"
      ],
      "resource_validation": "pending",
      "publish_status": "draft",
      "tags": [],
      "estimated_minutes": 45
    },
    {
      "id": "D01-T01-N02",
      "topic_id": "D01-T01",
      "title_zh_tw": "AI 應用辨識",
      "level": "intermediate",
      "prerequisite_ids": [
        "D01-T01-N01"
      ],
      "suggested_resource_ids": [
        "mit-ocw"
      ],
      "resource_validation": "pending",
      "publish_status": "draft",
      "tags": [],
      "estimated_minutes": 45
    },
    {
      "id": "D01-T01-N03",
      "topic_id": "D01-T01",
      "title_zh_tw": "AI 的限制",
      "level": "intermediate",
      "prerequisite_ids": [
        "D01-T01-N02"
      ],
      "suggested_resource_ids": [
        "mit-ocw"
      ],
      "resource_validation": "pending",
      "publish_status": "draft",
      "tags": [],
      "estimated_minutes": 45
    },
    {
      "id": "D01-T02-N01",
      "topic_id": "D01-T02",
      "title_zh_tw": "符號式人工智慧",
      "level": "intro",